"courseDetails","skuId","skuName"
"Single Byjus classes order validation for 4th standard with CBSE","SD04NA23,UB04NA23,TL7WZZ","4th Class Maths+Science (SD Card-Byjus) May-2023,4th Grade BYJU'S Classes May 2023,K-12 Lenovo Tablet (Add-on - BYJUS) (7 inch)"
"Combo order validation for UKG-LKG with CBSE","SD04NA22,SD05NA23,TL7WZZ,UB04NA22,UB05NA23","4th Class Maths+Science (SD Card-Byjus) May-2022,5th Class Maths+Science (SD Card-Byjus) May-2023,K-12 Lenovo Tablet (Add-on - BYJUS) (7 inch),4th Grade BYJU'S Classes May 2022,5th Grade BYJU'S Classes May 2023"
"Single Sibling Byjus classes order validation for 4th-5th standard with CBSE","SD04NA23,UB04NA23,SD05NA24,UB05NA24,TL7WZZ","4th Class Maths+Science (SD Card-Byjus) May-2023,4th Grade BYJU'S Classes May 2023,5th Class Maths+Science (SD Card-Byjus) May-2024,5th Grade BYJU'S Classes May 2024,K-12 Lenovo Tablet (Add-on - BYJUS) (7 inch)"
"Two Sibling Byjus classes order validation for 4th-5th standard with CBSE","SD04NA23,UB04NA23,SD05NA24,UB05NA24,TL7WZZ,SD04NA23,UB04NA23,SD05NA24,UB05NA24,TL7WZZ","4th Class Maths+Science (SD Card-Byjus) May-2023,4th Grade BYJU'S Classes May 2023,5th Class Maths+Science (SD Card-Byjus) May-2024,5th Grade BYJU'S Classes May 2024,K-12 Lenovo Tablet (Add-on - BYJUS) (7 inch),4th Class Maths+Science (SD Card-Byjus) May-2023,4th Grade BYJU'S Classes May 2023,5th Class Maths+Science (SD Card-Byjus) May-2024,5th Grade BYJU'S Classes May 2024,K-12 Lenovo Tablet (Add-on - BYJUS) (7 inch)"
"Streaming order validation for 4th and 5th class with CBSE","ST04CB23,ST05CB24","4th (Streaming) May-2023,5th (Streaming) May-2024"
"Competitive order validation for IAS with Hindi language","STCAHD22,STMTHD22,STPTHD22,SDASHE22,UBASHF22,STRGIANANA,TL7WZZ","IAS 2022 Hindi Current Affairs,IAS 2022 Hindi Mains Test series,IAS 2022 Hindi Prelims Test series,IAS Extension SD Card Hindi Full Dec 2022,IAS BYJU'S Classes Hindi Full Dec 2022,IAS BHLP Administration Fee,K-12 Lenovo Tablet (Add-on - BYJUS) (7 inch)"
